"","pgpub_id","cpc_sequence","cpc_section","cpc_class","cpc_subclass","cpc_group","cpc_type","cpc_version_indicator","cpc_symbol_position","application_id","filing_date","patent_type","filing_type","published_date","wipo_kind","series_code","application_title","application_abstract","rule_47_flag","filename","location_id","disambig_city","disambig_state","disambig_country","latitude","longitude","county","state_fips","county_fips","assignee_sequence","assignee_id","disambig_assignee_individual_name_first","disambig_assignee_individual_name_last","disambig_assignee_organization","assignee_type"
"1",20140044226,2,"G","G21","G21B","G21B1/23","inventional","2013-01-01","L",14057922,"2013-10-18","utility","","2014-02-13","A1",14,"Flexible Driver Laser for Inertial Fusion Energy","Embodiments of a laser system having an extremely large number of small pulsed lasers for irradiating small targets in inertial confinement fusion experiments, high energy density physics experiments, and inertial fusion power plants is more flexible than existing laser systems. Embodiments facilitate finer control of critical features of laser pulses for inertial fusion, as well as significant reduction in development costs and expansion of the community involved in the research relative to existing laser systems. Embodiments produce smooth intensity profiles at the target, large bandwidth that is over two orders of magnitude greater than existing laser systems, and fine control over laser wavelengths, focal properties, temporal pulse shape, and illumination geometry. Properties of each of the small pulsed lasers are individually selectable.",FALSE,"ipa140213.xml","fb52205e-16c7-11ed-9b5f-1234bde3cd05","Fairfax","VA","US",38.8462236,-77.3063733,"Fairfax (city)",51,600,1,"1eb25add-cd02-4ce7-9a3b-9bb4d0749f4e","","","Logos Technologies LLC",2
"2",20200161007,1,"G","G21","G21B","G21B1/03","inventional","2013-01-01","L",15822445,"2017-11-27","utility","","2020-05-21","A1",15,"High Yield ICF Target for Large Radiation Gains","A target assembly for Inertial Confinement Fusion (ICF) achieving a high yield energy output. This high gain target has a low Z fuel/shell region which is lined with a thin layer of a high Z material on the inner surface and then surrounds a low density hotspot region. Adding a thin high Z liner to the inside of the low Z fuel shell has many advantages. As the shell region compresses and heats the central low density hotspot region, the radiation will be contained, and unable to leave the core. This will lower the ignition temperature of target considerably (around a factor of 4). A high Z shell liner may also increase the burn fraction of the fuel as well as increase the areal density (?r) of the hotspot.",FALSE,"ipa200521.xml","cc7477c5-16c7-11ed-9b5f-1234bde3cd05","Colorado Springs","CO","US",38.8339578,-104.825348,"El Paso",8,41,1,"ad428b20-e4ae-4a65-afe9-449a13143a07","","","Innoven Energy LLC",2
"3",20200176133,0,"G","G21","G21B","G21B1/15","inventional","2013-01-01","F",16633081,"2018-07-20","utility","","2020-06-04","A1",16,"NUCLEAR FUSION REACTOR, THERMAL DEVICE, EXTERNAL COMBUSTION ENGINE, POWER GENERATING APPARATUS, AND MOVING OBJECT","An object of the present invention is to achieve a simple and safe nuclear fusion reactor. The nuclear fusion reactor comprises: a vessel serving as a reactor body; a metallic heating element that contains heavy hydrogen contained in the vessel as a solute; a heavy hydrogen gas contained in the vessel, the heavy hydrogen gas being in an amount that allows 0.005% to 5% of heavy hydrogen to be contained as a solute in the metallic heating element based on the atomic ratio; and a mechanism for irradiating the metallic heating element with an ion beam. Such configuration causes, in the metallic crystal of the metallic heating element, a channeling phenomenon which guides ion beams to interstitial atom nuclei, and an intra-metal nuclear fusion probability increasing phenomenon which is explained based on the binary nucleus model. As a result, a “mild nuclear fusion” that does not emit gamma rays and neutron rays occurs, and the nuclear energy can be efficiently converted into heat due to the intra-metal nuclear fusion chain reaction.",FALSE,"ipa200604.xml","42f90495-16c8-11ed-9b5f-1234bde3cd05","Tokyo","","JP",35.6828387,139.7594549,"",NA,NA,1,"79b123f7-2778-4da7-bc99-ca25ebae18f5","","","OOYAMA Power Inc.",3
"4",20130259179,1,"G","G21","G21B","G21B3/006","inventional","2013-01-01","L",13797407,"2013-03-12","utility","","2013-10-03","A1",13,"METHOD AND APPARATUS FOR GENERATING NUCLEAR FUSION USING CRYSTALLINE MATERIALS","Gently heating a pyroelectric crystal in a deuterated atmosphere can generate fusion under desktop conditions. The electrostatic field of the crystal is used to generate and accelerate a deuteron beam (>100 keV and >4 nA), which, upon striking a deuterated target, produces a neutron flux over 400 times the background level. The presence of neutrons within the target is confirmed by pulse shape analysis and proton recoil spectroscopy. Several elements of the system may be modified, including the configuration of the crystal or crystals, the composition of the surrounding environment and the target, the use of multiple probe tips, and the composition of the probe tip.",FALSE,"ipa131003.xml","c8a494cf-16c7-11ed-9b5f-1234bde3cd05","Oakland","CA","US",37.8044557,-122.2713563,"Alameda",6,1,1,"11ebf7e2-cb2d-4e63-a847-8887d790248d","","","The Regents of the University of California",2
"5",20150221405,3,"G","G21","G21B","G21B3/00","additional","2013-01-01","L",14421098,"2013-08-12","utility","","2015-08-06","A1",14,"METHOD AND APPARATUS FOR GENERATING NEUTRONS FROM METALS UNDER THERMAL SHOCK","A method and apparatus for generating neutrons by inducing hydride-forming metals infused with hydrogen isotopes to undergo rapid phase transitions. Such transitions are induced by exposing the metals to rapid temperature changes. The method includes placing the metals in a high-pressure reaction chamber, introducing a hydrogen isotope gas into the chamber to produce a metal hydride, reducing the temperature of the pressure chamber to maximize infusion of gas into metal, then quickly heating the reaction chamber, such that the temperature of the interior of the reaction chamber rapidly rises from a minimum temperature to a maximum temperature in an amount of time that is less than a thermal shock period. The temperatures and pressures are at such high levels that if two or more hydrogen isotope atoms are in the same void or defect within a crystalline lattice of the metal hydride, the atoms can react, resulting in neutron generation.",FALSE,"ipa150806.xml","d823b558-16c7-11ed-9b5f-1234bde3cd05","Columbia","MO","US",38.951883,-92.3337366,"Boone",29,19,1,"ad64bf63-f87f-47d2-9bd4-eab8c5892eb8","","","The Curators of the University of Missouri",2
"7",20130265130,3,"G","G21","G21B","G21B1/23","inventional","2013-01-01","L",13850763,"2013-03-26","utility","","2013-10-10","A1",13,"Electron-Coupled Transformer","An Electron-coupled transformer for generating a high voltage output pulse as an amplified version of an input pulse comprises a cylindrical triode electron tube with a central anode along main axis and a grid and cathode radially spaced from the anode. The anode has a first end connected to ground and a second end insulated with respect to said ground. The cathode and the grid form a traveling wave electron gun that produces a wave of ground potential in the Transverse Electric Mode, which causes electrons stored in the cathode-grid gap to be extracted from said gap. The extracted electrons form a radially symmetric collapsing traveling wave that sweeps as a wave along the anode at the speed of light, causing a voltage output pulse on the second end of the anode whose magnitude is an amplified version of an input pulse applied to the cathode.",FALSE,"ipa131010.xml","08354425-16c8-11ed-9b5f-1234bde3cd05","Newtown","CT","US",41.4134764,-73.3086445,"Fairfield",9,1,1,"4ff8d96b-aaf1-44de-b537-f6150d48a916","","","ADVANCED FUSION SYSTEMS LLC",2
"8",20180254116,1,"G","G21","G21B","G21B3/004","inventional","2013-01-01","L",15973231,"2018-05-07","utility","","2018-09-06","A1",15,"SYSTEMS TO GENERATE TRANSIENT, ELEVATED EFFECTIVE MASS LECTRON QUASIPARTICLES FOR TRANSMUTING RADIOACTIVE FISSION PRODUCTS AND RELATED METHODS","Some embodiments include systems to generate transient, elevated effective mass electron quasiparticles for transmuting radioactive fission products. Other embodiments of related systems and methods also are disclosed.",FALSE,"ipa180906.xml","c7a9ff69-16c7-11ed-9b5f-1234bde3cd05","Sequim","WA","US",48.0849312,-123.1096706,"Clallam",53,9,1,"e75d97a4-1058-467c-a956-e272d48d2dab","","","Tionesta Applied Research Corporation",2
"9",20080142717,0,"G","G21","G21B","G21B3/00","inventional","2013-01-01","F",11745556,"2007-05-08","utility","","2008-06-19","A1",11,"METHOD AND APPARATUS FOR GENERATING NUCLEAR FUSION USING CRYSTALLINE MATERIALS","Gently heating a pyroelectric crystal in a deuterated atmosphere can generate fusion under desktop conditions. The electrostatic field of the crystal is used to generate and accelerate a deuteron beam (>100 keV and >4 nA), which, upon striking a deuterated target, produces a neutron flux over 400 times the background level. The presence of neutrons within the target is confirmed by pulse shape analysis and proton recoil spectroscopy. Several elements of the system may be modified, including the configuration of the crystal or crystals, the composition of the surrounding environment and the target, the use of multiple probe tips, and the composition of the probe tip.",FALSE,"ipa080619.xml","c8a494cf-16c7-11ed-9b5f-1234bde3cd05","Oakland","CA","US",37.8044557,-122.2713563,"Alameda",6,1,1,"11ebf7e2-cb2d-4e63-a847-8887d790248d","","","The Regents of the University of California",2
"10",20100212133,1,"G","G21","G21B","G21B1/19","inventional","2013-01-01","L",12709321,"2010-02-19","utility","","2010-08-26","A1",12,"METHOD AND SYSTEM FOR ASSEMBLING MINIATURIZED DEVICES","An apparatus for assembling a miniaturized device includes a manipulator system including six manipulators operable to position and orient components of the miniaturized device with submicron precision and micron-level accuracy. The manipulator system includes a first plurality of motorized axes, a second plurality of manual axes, and force and torque and sensors. Each of the six manipulators includes at least one translation stage, at least one rotation stage, tooling attached to the at least one translation stage or the at least one rotation stage, and an attachment mechanism disposed at a distal end of the tooling and operable to attach at least a portion of the miniaturized device to the tooling. The apparatus also includes an optical coordinate-measuring machine (OCMM) including a machine-vision system, a laser-based distance-measuring probe, and a touch probe. The apparatus also includes an operator control system coupled to the manipulator system and the OCMM.",FALSE,"ipa100826.xml","2119e392-16c8-11ed-9b5f-1234bde3cd05","Livermore","CA","US",37.6820583,-121.7680531,"Alameda",6,1,1,"0af3cb8a-56df-43fd-9053-413569b63d0d","","","LAWRENCE LIVERMORE NATIONAL SECURITY, LLC",2
"11",20120281797,0,"G","G21","G21B","G21B3/00","inventional","2013-01-01","F",13511855,"2010-11-26","utility","","2012-11-08","A1",13,"HIGH VELOCITY DROPLET IMPACTS","A method of impacting liquid droplets onto a surface includes providing a series of liquid droplets, and directing the liquid droplets at a non-planar target surface to cause a shockwave in the droplets upon impact. An apparatus for impacting liquid droplets onto a surface includes a mechanism to produce a series of liquid droplets, and a mechanism to direct the liquid droplets at a non-planar target surface to cause a shockwave in the droplets upon impact. The non-planar target surface is shaped to intensify the shockwave in the droplets.",FALSE,"ipa121108.xml","87d6f9e7-16c8-11ed-9b5f-1234bde3cd05","Woodstock","","GB",51.8474887,-1.3545343,"",NA,NA,1,"e30b0f3b-f654-443d-8881-24f4b0b86d11","","","Isis Innovation Limited",3
"12",20220028568,0,"G","G21","G21B","G21B1/19","inventional","2013-01-01","F",17179221,"2021-02-18","utility","","2022-01-27","A1",17,"Compact Converters","A compact, simpler, more economical ICF target chamber and reactor design that maintains a low internal pressure, sub-atmospheric, and very small neutron flux on any pressure bearing vessel or steam generating mechanism. The present invention reduces radiant target emission towards the nearest wall of the hohlraum wall and/or sleeve material so that the radiation from target burn exits the end of the hohlraum through a wall material sufficiently thick to contain the target drive radiation, but becomes transparent to the target emitted radiation. The compact converter contains the energy released by the ICF target and converts it into usable heat to create steam. It also converts the excess neutrons, from the ICF target, into tritium. This is then collected with the unburnt fuel tritium.",FALSE,"","cc7477c5-16c7-11ed-9b5f-1234bde3cd05","Colorado Springs","CO","US",38.8339578,-104.825348,"El Paso",8,41,1,"ad428b20-e4ae-4a65-afe9-449a13143a07","","","Innoven Energy LLC",2
"13",20130235964,0,"G","G21","G21B","G21B3/006","inventional","2013-01-01","F",13416576,"2012-03-09","utility","","2013-09-12","A1",13,"ANEUTRONIC MAGNETRON ENERGY GENERATOR","An aneutronic magnetron energy generator that generates microwave energy from a fusion-fission reaction that produces alpha particles in response to a proton colliding with an 11B nucleus. The magnetron energy generator includes a magnetron having an anode resonator including a central chamber and a plurality of radially disposed cavities. A cathode assembly is provided at the center of the chamber and includes a cathode electrode that generates a proton plasma. A series of electrically isolated acceleration rings extend from the cathode electrode and operate to accelerate protons from the proton plasma towards an outer target ring composed of boron eleven (11B). The accelerated protons fuse with the 11B nuclei to generate the alpha particles that then interact with crossed electric and magnetic fields between the target ring and the cavities. The alpha particles resonate with the cavities and generate a current within the resonator that is collected.",FALSE,"ipa130912.xml","f656558d-16c7-11ed-9b5f-1234bde3cd05","Bloomfield Hills","MI","US",42.583645,-83.2454883,"Oakland",26,125,1,"51a24155-cf8a-423d-b29e-5431cd1b1f0f","","","Pryor Knowledge Systems, Inc.",2
"14",20150294744,0,"G","G21","G21B","G21B1/23","inventional","2013-01-01","F",14646765,"2013-10-04","utility","","2015-10-15","A1",14,"DEVICE FOR QUANTUM BEAM GENERATION, METHOD FOR QUANTUM BEAM GENERATION, AND DEVICE FOR LASER FUSION","The device has a target supply unit 4a for supplying a target 2a to a chamber 3a, a target monitor 5a for monitoring the target 2a present inside the chamber 3a, a laser light irradiator 6a for irradiating the target 2a present inside the chamber 3a, with laser light 8a, and a controller 7a. The target supply unit 4a emits the target 2a at a timing for emitting, that is controlled by the controller 7a, into a preset emission direction 3d inside the chamber 3a, and the controller 7a calculates an irradiation point 4d with the laser light 8a, calculates a timing for arriving of the target 2a at the irradiation point 4d, and makes the laser light irradiator 6a irradiate the target with the laser light, based on the irradiation point 4d and the timing for arriving.",FALSE,"ipa151015.xml","8bf1759c-16c8-11ed-9b5f-1234bde3cd05","Miyoshi","","JP",35.0993323,137.099531,"",NA,NA,2,"a4457e4c-1ee8-4bf8-946e-138c6b5565d2","","","Toyota Jidosha Kabushiki Kaisha",3
"17",20130329845,0,"G","G21","G21B","G21B1/00","inventional","2013-01-01","F",13823475,"2011-09-16","utility","","2013-12-12","A1",13,"SYSTEMS, APPARATUSES AND METHODS FOR THE IMPLEMENTATION OF AN ENERGY SYSTEM","In accordance with embodiments disclosed herein, there are provided systems, apparatuses and methods for the implementation of an energy system. A mechanical fusion energy system using uniquely constructed fuel pellets containing a variety of fusion capable materials to achieve up to many Megawatts of relatively continuous power output. The disclosed energy system utilizes a quantum approach of individual discrete pops periodically as needed to maintain a fairly continuous flow of energy. It may generate several thousand KWhr of energy per pop and dependent on the pop rate may generate well over 1,000 Megawatts, equivalent to the largest power generating stations currently in operation.",FALSE,"ipa131212.xml","12c9bbe6-16c8-11ed-9b5f-1234bde3cd05","Portland","OR","US",45.5202471,-122.674194,"Multnomah",41,51,1,"82102705-3b34-47b2-8498-fec177f0c73a","","","INTELLIGENT POWER CORP",2
"18",20220021290,2,"G","G21","G21B","G21B3/004","inventional","2013-01-01","L",17359385,"2021-06-25","utility","","2022-01-20","A1",17,"MAGNETOHYDRODYNAMIC HYDROGEN ELECTRICAL POWER GENERATOR","A power generator is described that provides at least one of electrical and thermal power comprising (i) at least one reaction cell for reactions involving atomic hydrogen hydrogen products identifiable by unique analytical and spectroscopic signatures, (ii) a molten metal injection system comprising at least one pump such as an electromagnetic pump that provides a molten metal stream to the reaction cell and at least one reservoir that receives the molten metal stream, and (iii) an ignition system comprising an electrical power source that provides low-voltage, high-current electrical energy to the at least one steam of molten metal to ignite a plasma to initiate rapid kinetics of the reaction and an energy gain. In some embodiments, the power generator may comprise: (v) a source of H2 and O2 supplied to the plasma, (vi) a molten metal recovery system, and (vii) a power converter capable of (a) converting the high-power light output from a blackbody radiator of the cell into electricity using concentrator thermophotovoltaic cells or (b) converting the energetic plasma into electricity using a magnetohydrodynamic converter.",FALSE,"","0bfbea71-16c8-11ed-9b5f-1234bde3cd05","Plainsboro","NJ","US",40.3334409,-74.6004341,"Middlesex",34,23,1,"a5bf7330-092b-4a9c-b862-60ec603d9ba5","","","BRILLIANT LIGHT POWER, INC.",2
"19",20190279778,0,"G","G21","G21B","G21B3/006","inventional","2013-01-01","F",16353638,"2019-03-14","utility","","2019-09-12","A1",16,"Relativistic Vacuum Diode for Focusing of Electron Beam","A relativistic vacuum diode (RVD) for extreme focusing of an electron beam is provided. The RVD may include an axisymmetric current-conducting vacuum chamber equipped with a demountable hatch for access into its cavity; an axisymmetric electrode assembly fixed in operative position in the central zone of the vacuum chamber. It additionally includes a plasma cathode composed of a thin central current-conducting rod and wide dielectric end element, and anode-enhancer shaped as a rod, one butt-end of which serves as a target for an electron beam. The target cross-section area is smaller, than the emitting area of said cathode's wide dielectric end element. Finally, a short-circuiter of reverse current is included in an earthed circuit of the anode-enhancer that surrounds said electrode assembly concentrically with radial clearance.",FALSE,"ipa190912.xml","e21807d6-16c7-11ed-9b5f-1234bde3cd05","Urbana","IL","US",40.1117174,-88.207301,"Champaign",17,19,1,"108e12ce-197c-4767-8a33-23678a6d0649","","","Proton Scientific, Inc.",2
"20",20210296011,0,"G","G21","G21B","G21B1/21","inventional","2013-01-01","F",17224972,"2021-04-07","utility","","2021-09-23","A1",17,"DEVICE AND COMPOSITIONS OF MATTER FOR ENERGIZING SELF-SUSTAINING REACTIONS IN SOLID STATE MATERIAL","A composition of matter including a fuel comprising one or more of isotopes of hydrogen or isotopes of lithium. The general binding reactions comprise electron-catalyzed chemical, molecular, or transmutation binding reactions. The composition also includes one or more reactants having an energy-releasing binding energy with the fuel. The fuel is associated with the general binding reactions with the one or more reactants. The composition additionally includes a reservoir capable of releasing one or more of molecular fuel or mono-atomic fuel when the reservoir is heated. The reservoir comprises one or more of the fuel or precursors to the fuel, such as a chemical form of fuel in the reservoir material. The composition further includes a fuel-cracking material capable of converting a fraction of the molecular fuel into mono-atomic fuel. The composition additionally includes a reaction crystallite on or in which general binding reactions are capable of being stimulated to occur. The composition further includes a spacer. Upon the one or more reaction capsule emissions of one or more of the proximate reaction capsules, the fuel is released from the reservoir, the fuel-cracking material is brought to operating temperature, a temperature of the reaction crystallite is raised sufficient to cause crystal momentum injection, electrons are tailored by the energy-releasing binding energy and the crystal momentum injections into the reactant crystallite, and an emission of the reaction capsule energizes one or more of the proximate reaction capsules to cause a self-sustaining or chain reaction. Other embodiments are described.",FALSE,"","c7a9ff69-16c7-11ed-9b5f-1234bde3cd05","Sequim","WA","US",48.0849312,-123.1096706,"Clallam",53,9,1,"e75d97a4-1058-467c-a956-e272d48d2dab","","","Tionesta Applied Research Corporation",2
"21",20170133110,0,"G","G21","G21B","G21B1/19","inventional","2013-01-01","F",15323116,"2015-05-15","utility","","2017-05-11","A1",15,"METHOD FOR MANUFACTURING FUEL CAPSULE FOR LASER FUSION","The present invention relates to a method for manufacturing a fuel capsule for laser fusion, the method including a liquid droplet formation step, using a combined nozzle 3 equipped with a first nozzle 6 and a second nozzle 7 having a discharge port surrounding a discharge port 61 of the first nozzle, of discharging water 8 from the first nozzle and organic liquids 9A, 9B containing an organic solvent from the second nozzle simultaneously into a stabilizing liquid 13 to thereby form liquid droplets 12 in which the water is covered with the organic liquids, an organic solvent removal step of removing the organic solvent from the liquid droplets, and a water removal step of removing the water covered with the organic liquid having formed the liquid droplets. The first organic polymer and the second organic polymer are used which can be mutually phase-separated.",FALSE,"ipa170511.xml","5a829c9c-16c8-11ed-9b5f-1234bde3cd05","Nanbu","","JP",35.259129,138.458633,"",NA,NA,1,"711e68ae-5fdc-45a3-a91c-c0d053d3d70d","","","HAMAMATSU PHOTONICS K.K.",3
"22",20200002828,1,"G","G21","G21B","G21B3/00","inventional","2013-01-01","F",16567689,"2019-09-11","utility","","2020-01-02","A1",16,"ELECTRICAL POWER GENERATION SYSTEMS AND METHODS REGARDING SAME","A solid or liquid fuel to plasma to electricity power source that provides at least one of electrical and thermal power comprising (i) at least one reaction cell for the catalysis of atomic hydrogen to form hydrinos, (ii) a chemical fuel mixture comprising at least two components chosen from: a source of H2O catalyst or H2O catalyst; a source of atomic hydrogen or atomic hydrogen; reactants to form the source of H2O catalyst or H2O catalyst and a source of atomic hydrogen or atomic hydrogen; one or more reactants to initiate the catalysis of atomic hydrogen; and a material to cause the fuel to be highly conductive, (iii) a fuel injection system such as a railgun shot injector, (iv) at least one set of electrodes that confine the fuel and an electrical power source that provides repetitive short bursts of low-voltage, high-current electrical energy to initiate rapid kinetics of the hydrino reaction and an energy gain due to forming hydrinos to form a brilliant-light emitting plasma, (v) a product recovery system such as at least one of an augmented plasma railgun recovery system and a gravity recovery system, (vi) a fuel pelletizer or shot maker comprising a smelter, a source or hydrogen and a source of H2O, a dripper and a water bath to form fuel pellets or shot, and an agitator to feed shot into the injector, and (vii) a power converter capable of converting the high-power light output of the cell into electricity such as a concentrated solar power device comprising a plurality of ultraviolet (UV) photoelectric cells or a plurality of photoelectric cells, and a UV window.",FALSE,"ipa200102.xml","09505cb9-16c8-11ed-9b5f-1234bde3cd05","Cranbury","NJ","US",40.3162195,-74.5137645,"Middlesex",34,23,1,"a5bf7330-092b-4a9c-b862-60ec603d9ba5","","","BRILLIANT LIGHT POWER, INC.",2
