"","pgpub_id","cpc_sequence","cpc_section","cpc_class","cpc_subclass","cpc_group","cpc_type","cpc_version_indicator","cpc_symbol_position","application_id","filing_date","patent_type","filing_type","published_date","wipo_kind","series_code","application_title","application_abstract","rule_47_flag","filename","location_id","disambig_city","disambig_state","disambig_country","latitude","longitude","county","state_fips","county_fips","assignee_sequence","assignee_id","disambig_assignee_individual_name_first","disambig_assignee_individual_name_last","disambig_assignee_organization","assignee_type"
"250",20050135960,0,"G","G21","G21B","G21B1/13","inventional","2013-01-01","F",10954958,"2004-09-30","utility","us-original-publication-voluntary","2005-06-23","A1",10,"Material including beryllium intermetallic compound and having excellent high-temperature property applied to nuclear fusion reactor","A material for a nuclear fusion reactor of the present invention contains intermetallic compounds of beryllium with Ti, V, Zr, Nb, Ta, Mo, W or Y. The beryllium intermetallic compounds are mixed with another metal or intermetallic compound. The material is preferably applied to blankets and facing members which are exposed to neutrons and heat generated by plasma of the nuclear fusion reactor.",FALSE,"ipa050623.xml","8bf1423e-16c8-11ed-9b5f-1234bde3cd05","Nagoya","","JP",35.1851045,136.8998438,"",NA,NA,1,"9f1156d0-251b-4749-bcea-69c797d68390","","","NGK INSULATORS, LTD.",3
"253",20210158977,0,"G","G21","G21B","G21B1/052","inventional","2013-01-01","F",17167187,"2021-02-04","utility","","2021-05-27","A1",17,"SYSTEM AND METHOD FOR SMALL, CLEAN, STEADY-STATE FUSION REACTORS","According to some embodiments, a system for widening and densifying a scrape-off layer (SOL) in a field reversed configuration (FRC) fusion reactor is disclosed. The system includes a gas box at one end of the reactor including a gas inlet system and walls of suitable heat bearing materials. The system further includes an exit orifice adjoining the gas box, wherein the exit orifice has a controllable radius and length to allow plasma to flow out from the gas box to populate the SOL with the plasma. The system may also include fusion products, which decrease in speed in the plasma in the SOL, allowing energy to be extracted and converted into thrust or electrical power and further allowing ash to be extracted to reduce neutron emissions and maintain high, steady-state fusion power.",FALSE,"","08356fad-16c8-11ed-9b5f-1234bde3cd05","Princeton","NJ","US",40.3492744,-74.6592958,"Mercer",34,21,1,"43de0fb5-fd36-411d-b6d3-ca4cf1668cc7","","","THE TRUSTEES OF PRINCETON UNIVERSITY",2
"254",20170011811,0,"G","G21","G21B","G21B1/115","inventional","2013-01-01","F",15116025,"2015-02-06","utility","","2017-01-12","A1",15,"ADVANCED FUEL CYCLE AND FUSION REACTORS UTILIZING THE SAME","Examples of advanced fuel cycles for fusion reactors are described. Examples include fuel cycles for use in field reverse configuration (FRC) plasma reactors. In some examples, reaction gases may be removed from a fusion reactor between pulses (e.g. plasmoid collisions). In some examples, a D-3He reaction is performed, with the 3He provided from decay of byproducts of previous reactions (e.g. tritium).",FALSE,"ipa170112.xml","816d1200-16c8-11ed-9b5f-1234bde3cd05","Redmond","WA","US",47.6694141,-122.1238767,"King",53,33,1,"44901aa1-dfe8-43ce-973d-07ffdf518ab8","","","HELION ENERGY, INC.",2
"255",20120033775,0,"G","G21","G21B","G21B1/05","inventional","2013-01-01","F",13197836,"2011-08-04","utility","","2012-02-09","A1",13,"METHOD AND APPARATUS FOR INTERMEDIATE CONTROLLED FUSION PROCESSES","A method and apparatus for producing usable heat by fusion of two atoms within a vessel filled with a gas. The fusion is performed under pressure within an electric arc between two electrodes within the vessel. The electron clouds of the atoms are deformed into a toroidal shape by a magnetic field of the electric arc, thereby exposing the nuclei of both atoms. Upon such exposure, a trigger such as a sudden change in the arc or a sudden increase of pressure in the vessel forces the nuclei of the atoms to fuse, producing a new atom. Selection of the gas, the electrodes, as well as the operating power, pressure and flow through the arc results in the production of energy that is greater than the electric energy consumed by the arc. Heat produced by the fusion is used for the production of electricity or other commercial use.",FALSE,"ipa120209.xml","f50af595-16c7-11ed-9b5f-1234bde3cd05","Palm Harbor","FL","US",28.0780718,-82.7637127,"Pinellas",12,103,1,"15826eff-cb4d-4b73-92ec-52be0ee3856c","","","HIGHFUELS, INC.",2
"256",20110255645,0,"G","G21","G21B","G21B3/00","inventional","2013-01-01","F",13070552,"2011-03-24","utility","","2011-10-20","A1",13,"Method for Producing Heavy Electrons","A method for producing heavy electrons is based on a material system that includes an electrically-conductive material is selected. The material system has a resonant frequency associated therewith for a given operational environment. A structure is formed that includes a non-electrically-conductive material and the material system. The structure incorporates the electrically-conductive material at least at a surface thereof. The geometry of the structure supports propagation of surface plasmon polaritons at a selected frequency that is approximately equal to the resonant frequency of the material system. As a result, heavy electrons are produced at the electrically-conductive material as the surface plasmon polaritons propagate along the structure.",FALSE,"ipa111020.xml","fe1dd7c7-16c7-11ed-9b5f-1234bde3cd05","Washington","DC","US",38.8950368,-77.0365427,"District of Columbia",11,1,1,"2392e93f-c189-49f3-a769-ad19ffb98c46","","","U.S.A. as Represented by the Administrator of the National Aeronautics and Space Administration",6
"257",20170094768,0,"G","G21","G21B","G21B1/19","inventional","2013-01-01","L",15142628,"2016-04-29","utility","","2017-03-30","A1",15,"TARGETS AND PROCESSES FOR FABRICATING SAME","In particular embodiments, the present disclosure provides targets including a metal layer and defining a hollow inner surface. The hollow inner surface has an internal apex. The distance between at least two opposing points of the internal apex is less than about 15 ?m. In particular examples, the distance is less than about 1 ?m. Particular implementations of the targets are free standing. The targets have a number of disclosed shaped, including cones, pyramids, hemispheres, and capped structures. The present disclosure also provides arrays of such targets. Also provided are methods of forming targets, such as the disclosed targets, using lithographic techniques, such as photolithographic techniques. In particular examples, a target mold is formed from a silicon wafer and then one or more sides of the mold are coated with a target material, such as one or more metals.",FALSE,"ipa170330.xml","c5831645-16c7-11ed-9b5f-1234bde3cd05","Reno","NV","US",39.5261206,-119.8126581,"Washoe",32,31,1,"5bccab45-57dd-47ea-a913-3202168c1d10","","","THE BOARD OF REGENTS OF THE NEVADA SYSTEM OF HIGHER EDUCATION ON BEHALF OF THE UNIVERSITY OF NEVADA",2
"261",20200027571,2,"G","G21","G21B","G21B1/19","inventional","2013-01-01","L",16191669,"2018-11-15","utility","","2020-01-23","A1",16,"Thermal Wave Drive for ICF Targets","A system and method for driving an ICF target with a thermal wave comprising: a target assembly, located inside a hohlraum, comprising a drive region, shell region and central fuel region; wherein said hohlraum comprises one or more laser entrance apertures; wherein said one or more laser entrance apertures are sized according to the shape of said hohlraum and to prevent energy from escaping said hohlraum; a laser assembly to irradiate a laser pulse through said laser entrance apertures; inner walls of said hohlraum to reradiate said laser pulse as x-ray radiation; wherein said x-ray radiation penetrates the target assembly as a thermal wave before any significant hydrodynamic motion occurs within said target assembly during the time in which the laser assembly is active; wherein said drive region is evenly heated to a sufficient temperature to expand in an inward and outward direction; and wherein said shell region is launched into said fuel region to drive said ICF target.",FALSE,"ipa200123.xml","cc7477c5-16c7-11ed-9b5f-1234bde3cd05","Colorado Springs","CO","US",38.8339578,-104.825348,"El Paso",8,41,1,"ad428b20-e4ae-4a65-afe9-449a13143a07","","","Innoven Energy LLC",2
"264",20210047961,6,"G","G21","G21B","G21B3/00","inventional","2013-01-01","L",16925892,"2020-07-10","utility","","2021-02-18","A1",16,"POWER GENERATION SYSTEMS AND METHODS REGARDING SAME","An electrochemical power system is provided that generates an electromotive force (EMF) from the catalytic reaction of hydrogen to lower energy (hydrino) states providing direct conversion of the energy released from the hydrino reaction into electricity, the system comprising at least two components chosen from: H2O catalyst or a source of H2O catalyst; atomic hydrogen or a source of atomic hydrogen; reactants to form the H2O catalyst or source of H2O catalyst and atomic hydrogen or source of atomic hydrogen; and one or more reactants to initiate the catalysis of atomic hydrogen. The electrochemical power system for forming hydrinos and electricity can further comprise a cathode, an anode, reactants that constitute hydrino reactants during cell operation with separate electron flow and ion mass transport, a source of oxygen, and a source of hydrogen. Due to oxidation-reduction electrode reactions, the hydrino-producing reaction mixture is constituted with the migration of electrons through an external circuit and ion mass transport through a separate path such as the electrolyte to complete an electrical circuit. In an embodiment, the anode is regenerated by intermittent charging with the electrodeposition of the anode metal ion from the electrolyte to the anode wherein an anion exchange with the anode metal oxide provides a thermodynamically favorable cycle to facilitate the electrodeposition.
A solid fuel power source that provides at least one of thermal and electrical power such as direct electricity or thermal to electricity is further provided that powers a power system comprising (i) at least one reaction cell for the catalysis of atomic hydrogen to form hydrinos, (ii) a chemical fuel mixture comprising at least two components chosen from: a source of H2O catalyst or H2O catalyst; a source of atomic hydrogen or atomic hydrogen; reactants to form the source of H2O catalyst or H2O catalyst and a source of atomic hydrogen or atomic hydrogen; one or more reactants to initiate the catalysis of atomic hydrogen; and a material to cause the solid fuel to be highly conductive, (iii) at least one set of electrodes that confine the fuel and an electrical power source that provides a short burst of low-voltage, high-current electrical energy to initiate rapid kinetics of the hydrino reaction and an energy gain due to forming hydrinos, (iv) a product recovery systems such as a condensor, (v) a reloading system, (vi) at least one of hydration, thermal, chemical, and electrochemical systems to regenerate the fuel from the reaction products, (vii) a heat sink that accepts the heat from the power-producing reactions, (viii) a power conversion system that may comprise a direct plasma to electric converter such as a plasmadynamic converter, magnetohydrodynamic converter, electromagnetic direct (crossed field or drift) converter, {right arrow over (E)}×{right arrow over (B)} direct converter, and charge drift converter or a thermal to electric power converter such as a Rankine or Brayton-type power plant.",FALSE,"ipa210218.xml","09505cb9-16c8-11ed-9b5f-1234bde3cd05","Cranbury","NJ","US",40.3162195,-74.5137645,"Middlesex",34,23,1,"a5bf7330-092b-4a9c-b862-60ec603d9ba5","","","BRILLIANT LIGHT POWER, INC.",2
"265",20140226772,0,"G","G21","G21B","G21B3/006","inventional","2013-01-01","F",14348137,"2012-08-08","utility","","2014-08-14","A1",14,"RADIATION GENERATING APPARATUS AND RADIATION GENERATING METHOD","A radiation generating apparatus comprises a fuel storage unit 20 for storing a mixed liquid 61, a pressure application unit 10 for applying a pressure to the mixed liquid 61, a jet formation unit 30 for forming a jet 61a of the mixed liquid 61, a reaction unit 44 for forming the jet 61a of the mixed liquid 61 therein, a pressure adjustment unit 41 for setting a pressure in the reaction unit 44 lower than an internal pressure of the jet formation unit 30, and a light source unit 45 for irradiating a particle group 63a with laser light L1.",FALSE,"ipa140814.xml","5a829c9c-16c8-11ed-9b5f-1234bde3cd05","Nanbu","","JP",35.259129,138.458633,"",NA,NA,1,"711e68ae-5fdc-45a3-a91c-c0d053d3d70d","","","HAMAMATSU PHOTONICS K.K.",3
"266",20190259502,1,"G","G21","G21B","G21B1/17","inventional","2013-01-01","F",16334050,"2017-09-01","utility","","2019-08-22","A1",16,"VACUUM PLASMA REACTOR","A device for electrically connecting components situated inside a nuclear fusion reactor chamber to the vacuum vessel of the reactor has two identical stacks of electrically conductive plates. The electrically conductive plates are in the shape of a symmetrical wave having at least one full period. The plates in a stack are nested one inside another and are connected to flanges for attachment to a component situated inside the chamber and to the vacuum vessel. The stacks of electrically conductive plates are mounted with mirror symmetry about a line that passes through the centers of symmetry of the flanges. The device ensures a substantially identical skin effect on all of the electrically conductive plates. In addition, the force of attraction between the outermost and center plates (the force of attraction between conductors carrying unidirectional currents) is reduced and a uniform current density distribution in each electrically conductive plate is provided.",FALSE,"ipa190822.xml","13796783-16c8-11ed-9b5f-1234bde3cd05","Moscow","","RU",55.7504461,37.6174943,"",NA,NA,1,"c3b46d8e-984f-4036-9374-b357ea49789a","","","STATE ATOMIC ENERGY CORPORATION “ROSATOM” ON BEHALF OF THE RUSSIAN FEDERATION",3
"267",20150181688,2,"G","G21","G21B","G21B1/11","inventional","2013-01-01","L",12025096,"2008-02-04","utility","","2015-06-25","A1",12,"Neutron Generator","A neutron generator includes a sealed envelope providing a low pressure environment for a gas of hydrogen isotope(s). One end of the envelope defines an ion source chamber. A target electrode is disposed at the other end of the envelope. An extraction electrode is spaced apart from the target electrode by an accelerating gap. The extraction electrode bounds the ion source chamber. An RF antenna is disposed external to the sealed envelope in the vicinity of the ion source chamber. The RF antenna is used to transmit time-varying electromagnetic fields within the ion source chamber for producing plasma therein. The extraction electrode operates at a positive high voltage potential and the target electrode operates at or near ground potential in order to provide an electric field gradient that accelerates ions of the plasma towards the target electrode to induce collisions of ions with target material, thereby causing fusion reactions that generate and emit neutrons from the target material. High voltage insulation is disposed between the RF antenna and both the ion source chamber and the extraction electrode for electrically insulating the RF antenna operating at or near ground potential from the high voltages of the ion source chamber and the extraction electrode.",FALSE,"ipa150625.xml","cf4944e5-16c7-11ed-9b5f-1234bde3cd05","Sugar Land","TX","US",29.6196787,-95.6349463,"Fort Bend",48,157,1,"85bf5e09-3822-48f8-a72c-0ed9c4b240a1","","","Schlumberger Technology Corporation",2
"273",20090175400,0,"G","G21","G21B","G21B1/13","inventional","2013-01-01","F",12404901,"2009-03-16","utility","","2009-07-09","A1",12,"First-Wall Component for a Fusion Reactor with a Heat Sink of a Copper Alloy","A first-wall component of a fusion reactor has a heat shield and a heat sink. The heat shield is formed of a material from the group of graphite material, carbidic material, tungsten and tungsten alloy. The heat sink is formed of a spray-compacted copper alloy.",FALSE,"ipa090709.xml","2b28ad3c-16c8-11ed-9b5f-1234bde3cd05","Reutte","","AT",47.4891092,10.7187955,"",NA,NA,1,"3d9993b0-e15c-4f63-889f-b302bc0e3b49","","","Plansee SE",3
"274",20130037978,5,"G","G21","G21B","G21B1/19","inventional","2013-01-01","L",13654847,"2012-10-18","utility","","2013-02-14","A1",13,"METHODS OF MANUFACTURING DIAMOND CAPSULES","Capsules and similar objects are made from materials having diamond (sp3) lattice structures, including diamond materials in synthetic crystalline, polycrystalline (ordered or disordered), nanocrystalline and amorphous forms. The capsules generally include a hollow shell made of a diamond material that defines an interior region that may be empty or that may contain a fluid or solid material. Some of the capsules include access ports that can be used to fill the capsule with a fluid. Capsules and similar structures can be manufactured by growing diamond on suitably shaped substrates. In some of these methods, diamond shell sections are grown on substrates, then joined together. In other methods, a nearly complete diamond shell is grown around a form substrate, and the substrate can be removed through a relatively small opening in the shell.",FALSE,"ipa130214.xml","439af3dd-16c8-11ed-9b5f-1234bde3cd05","Dallas","TX","US",32.7762719,-96.7968559,"Dallas",48,113,1,"384ce8b2-3d39-4286-beb1-e91a98b7729b","","","Terraspan LLC",2
"275",20160118144,0,"G","G21","G21B","G21B3/006","inventional","2013-01-01","F",14892923,"2014-05-16","utility","","2016-04-28","A1",14,"HYDROGEN-LITHIUM FUSION DEVICE","The Hydrogen-Lithium Fusion Device (HLFD) includes a plasma generator that generates proton-lithium plasma within a reaction chamber. The plasma generator includes a proton source and lithium source. In one implementation, bias voltage is applied within the reaction chamber. The bias voltage enables protons to fuse with lithium ions in the proton-lithium plasma, whereby energetic helium ion fusion byproducts are produced. Multiple configurations of reaction chambers containing protons and lithium ions under conditions that yield proton-lithium fusion are disclosed.",FALSE,"ipa160428.xml","b86c5343-16c7-11ed-9b5f-1234bde3cd05","Los Altos","CA","US",37.3790629,-122.116578,"Santa Clara",6,85,1,"df4d2b1b-28a7-4f26-9b1a-e2501b08ec66","","","Unified Gravity Corporation",2
"276",20110091004,0,"G","G21","G21B","G21B1/01","inventional","2013-01-01","F",12681339,"2008-09-30","utility","","2011-04-21","A1",12,"TRISO FUEL FOR HIGH BURN-UP NUCLEAR ENGINE","A fuel particle for use in a fusion-fission nuclear engine includes a fuel kernel and a buffer layer surrounding the fuel kernel. The fuel particle also includes a pyrolytic carbon layer surrounding the buffer layer and a silicon carbide layer surrounding the buffer layer. The silicon carbide is characterized by a stress less than 450 MPa at 95% burn-up. The fuel particle further includes a second pyrolytic carbon layer surrounding the silicon carbide layer.",FALSE,"ipa110421.xml","2119e392-16c8-11ed-9b5f-1234bde3cd05","Livermore","CA","US",37.6820583,-121.7680531,"Alameda",6,1,1,"0af3cb8a-56df-43fd-9053-413569b63d0d","","","LAWRENCE LIVERMORE NATIONAL SECURITY, LLC",2
"277",20150030115,1,"G","G21","G21B","G21B3/002","inventional","2013-01-01","L",14374483,"2013-01-29","utility","","2015-01-29","A1",14,"NUCLIDE TRANSMUTATION METHOD AND NUCLIDE TRANSMUTATION DEVICE","A nuclide transmutation device and method which enable nuclide transmutation to be performed in a small-scale device compared with large-scale devices are disclosed. The device comprises a structure, and high and low deuterium concentration units are disposed on either side of the structure so as to sandwich the structure therebetween, wherein an electrolytic solution containing heavy water is supplied to the high deuterium concentration unit and is electrolyzed to generate deuterium, thereby producing a state of high deuterium concentration near the high deuterium concentration unit side surface and placing the low deuterium concentration unit in a state of low deuterium concentration relative to the high deuterium concentration unit, causing the deuterium to penetrate through the structure from the high deuterium concentration unit toward the low deuterium concentration unit, and subjecting a substance to nuclide transmutation by reaction with the deuterium.",FALSE,"ipa150129.xml","42f90495-16c8-11ed-9b5f-1234bde3cd05","Tokyo","","JP",35.6828387,139.7594549,"",NA,NA,1,"8c6f9cc8-db14-4f7d-97dd-beb805889fe0","","","MITSUBISHI HEAVY INDUSTRIES, LTD.",3
"279",20120263265,1,"G","G21","G21B","G21B3/002","inventional","2013-01-01","L",13483921,"2012-05-30","utility","","2012-10-18","A1",13,"NUCLIDE TRANSMUTATION DEVICE AND NUCLIDE TRANSMUTATION METHOD","A nuclide processing method which binds a first nuclide material including at least one of Cs, C, and Sr that undergoes nuclide transmutation to a surface layer of a multilayer structure body. The method heats the multilayer structure body by the heater. The method supplies deuterium gas, at atmospheric pressure supplied from a tank of deuterium, into an absorption chamber holding the multilayer structure body, and evacuates a desorption chamber holding the multilayer structure body to a vacuum level below atmospheric pressure to provide a flow of the deuterium gas that penetrates through the heated multilayer structure body and the first nuclide material bound on the multilayer structure body.",FALSE,"ipa121018.xml","42f90495-16c8-11ed-9b5f-1234bde3cd05","Tokyo","","JP",35.6828387,139.7594549,"",NA,NA,1,"8c6f9cc8-db14-4f7d-97dd-beb805889fe0","","","MITSUBISHI HEAVY INDUSTRIES, LTD.",3
"280",20090191417,6,"G","G21","G21B","G21B1/11","inventional","2013-01-01","L",12358471,"2009-01-23","utility","","2009-07-30","A1",12,"PERMEATION BARRIER LAYER","The method for manufacturing a hydrogen permeation barrier comprises the steps of

    a) depositing on a substrate (SUB) a layer system (LS) comprising at least one layer (L1,L2,L3);

characterized in that step a) comprises the step of

    b) depositing at least one hydrogen barrier layer (HPBL) comprising an at least ternary oxide.


The apparatus comprises a sealable volume and a wall forming at least a portion of a boundary limiting said volume, wherein said wall comprises a hydrogen permeation barrier comprising a layer system (LS) comprising at least one layer, wherein said layer system comprises at least one hydrogen barrier layer (HPBL) comprising an at least ternary oxide.
Preferably, said at least ternary oxide is substantially composed of Al, Cr and O, and said depositing said at least one hydrogen barrier layer (HPBL) is carried out using a physical vapor deposition method, in particular a cathodic arc evaporation method.
Preferably, step a) comprises depositing on said substrate at least one of: an adhesion layer (AdhL), a hydrogen storage layer (HStL), a protective layer (ProtL), in particular a thermal barrier layer (ThBL), a diffusion barrier layer (DBL), an oxidation barrier layer (OxBL), a chemical barrier layer (ChBL), a wear resistance layer (WRL).
Excellent hydrogen permeation barrier properties can be achieved, and the layer system can be tailored as required by an envisaged application.",FALSE,"ipa090730.xml","2d50556d-16c8-11ed-9b5f-1234bde3cd05","Wetzikon","","CH",47.3226925,8.7980939,"",NA,NA,1,"dfceb878-95ea-44da-9bea-8cfc775e7814","","","OERLIKON TRADING AG, TRUEBBACH",3
"282",20130266106,1,"G","G21","G21B","G21B3/00","inventional","2013-01-01","L",13591162,"2012-08-21","utility","","2013-10-10","A1",13,"METHODS OF GENERATING ENERGETIC PARTICLES USING NANOTUBES AND ARTICLES THEREOF","There is disclosed a method of generating energetic particles, which comprises contacting nanotubes with a source of hydrogen isotopes, such as D2O, and applying activation energy to the nanotubes. In one embodiment, the hydrogen isotopes comprises protium, deuterium, tritium, and combinations thereof. There is also disclosed a method of transmuting matter that is based on the increased likelihood of nuclei interaction for atoms confined in the limited dimensions of a nanotube structure, which generates energetic particles sufficient to transmute matter and exposing matter to be transmuted to these particles.",FALSE,"ipa131010.xml","07e61a62-16c8-11ed-9b5f-1234bde3cd05","Windsor","VT","US",43.4798875,-72.3866266,"Windsor",50,27,1,"abc1e58b-4fff-441e-aace-ef79b395210d","","","Seldon Technologies, Inc.",2
