"","pgpub_id","cpc_sequence","cpc_section","cpc_class","cpc_subclass","cpc_group","cpc_type","cpc_version_indicator","cpc_symbol_position","application_id","filing_date","patent_type","filing_type","published_date","wipo_kind","series_code","application_title","application_abstract","rule_47_flag","filename","location_id","disambig_city","disambig_state","disambig_country","latitude","longitude","county","state_fips","county_fips","assignee_sequence","assignee_id","disambig_assignee_individual_name_first","disambig_assignee_individual_name_last","disambig_assignee_organization","assignee_type"
"135",20180025792,2,"G","G21","G21B","G21B1/19","additional","2013-01-01","L",15682129,"2017-08-21","utility","","2018-01-25","A1",15,"METHOD AND APPARATUS FOR THE GENERATION, HEATING AND/OR COMPRESSION OF PLASMOIDS AND/OR RECOVERY OF ENERGY THEREFROM","Method and apparatus for heating and/or compressing plasmas to thermonuclear temperatures and densities are provided. In one aspect, at least one of at least two plasmoids separated by a distance is accelerated towards the other. The plasmoids interact, for instance to form a resultant plasmoid, to convert a kinetic energy into a thermal energy. The resultant plasmoid is confined in a high energy density state using a magnetic field. One or more plasmoids may be compressed. Energy may be recovered, for example via a blanket and/or directly via one or more coils that create a magnetic field and/or circuits that control the coils.",FALSE,"ipa180125.xml","816d1200-16c8-11ed-9b5f-1234bde3cd05","Redmond","WA","US",47.6694141,-122.1238767,"King",53,33,1,"f7ad7c1d-d742-4b4c-b029-78fc01493681","","","MSNW LLC",2
"143",20180047461,0,"G","G21","G21B","G21B1/052","inventional","2013-01-01","F",15552665,"2016-02-24","utility","","2018-02-15","A1",15,"SYSTEM AND METHOD FOR SMALL, CLEAN, STEADY-STATE FUSION REACTORS","According to some embodiments, a system for widening and densifying a scrape-off layer (SOL) in a field reversed configuration (FRC) fusion reactor is disclosed. The system includes a gas box at one end of the reactor including a gas inlet system and walls of suitable heat bearing materials. The system further includes an exit orifice adjoining the gas box, wherein the exit orifice has a controllable radius and length to allow plasma to flow out from the gas box to populate the SOL with the plasma. The system may also include fusion products, which decrease in speed in the plasma in the SOL, allowing energy to be extracted and converted into thrust or electrical power and further allowing ash to be extracted to reduce neutron emissions and maintain high, steady-state fusion power.",FALSE,"ipa180215.xml","08356fad-16c8-11ed-9b5f-1234bde3cd05","Princeton","NJ","US",40.3492744,-74.6592958,"Mercer",34,21,1,"43de0fb5-fd36-411d-b6d3-ca4cf1668cc7","","","THE TRUSTEES OF PRINCETON UNIVERSITY",2
"144",20140211900,0,"G","G21","G21B","G21B1/057","inventional","2013-01-01","F",14240809,"2012-08-24","utility","","2014-07-31","A1",14,"Efficient Compact Fusion Reactor","An efficient compact nuclear fusion reactor for use as a neutron source or energy source is described. The reactor comprises a toroidal plasma chamber and a plasma confinement system arranged to generate a magnetic field for confining a plasma in the chamber. The plasma confinement system is configured so that a major radius of the confined plasma is 1.5 m or less. The reactor is constructed using high temperature superconducting toroidal magnets, which may be operated at low temperature (77K or lower) to provide enhanced performance. The toroidal magnetic field can be increased to 5 T or more giving significant increases in fusion output, so that neutron output is very efficient and the reactor can produce a net output of energy.",FALSE,"ipa140731.xml","87d6f9e7-16c8-11ed-9b5f-1234bde3cd05","Woodstock","","GB",51.8474887,-1.3545343,"",NA,NA,1,"748c89bb-197d-4130-a86b-fab4f88e4bcd","","","TOKAMAK SOLUTIONS UK LIMITED",3
"145",20130108022,2,"G","G21","G21B","G21B1/23","inventional","2013-01-01","L",13662038,"2012-10-26","utility","","2013-05-02","A1",13,"METHOD FOR CHARACTERIZATION OF A SPHERICALLY BENT CRYSTAL FOR K-alpha X-RAY IMAGING OF LASER PLASMAS USING A FOCUSING MONOCHROMATOR GEOMETRY","A method is provided for characterizing spectrometric properties (e.g., peak reflectivity, reflection curve width, and Bragg angle offset) of the K? emission line reflected narrowly off angle of the direct reflection of a bent crystal and in particular of a spherically bent quartz 200 crystal by analyzing the off-angle x-ray emission from a stronger emission line reflected at angles far from normal incidence. The bent quartz crystal can therefore accurately image argon K? x-rays at near-normal incidence (Bragg angle of approximately 81 degrees). The method is useful for in-situ calibration of instruments employing the crystal as a grating by first operating the crystal as a high throughput focusing monochromator on the Rowland circle at angles far from normal incidence (Bragg angle approximately 68 degrees) to make a reflection curve with the He-like x-rays such as the He-? emission line observed from a laser-excited plasma.",FALSE,"ipa130502.xml","2119e392-16c8-11ed-9b5f-1234bde3cd05","Livermore","CA","US",37.6820583,-121.7680531,"Alameda",6,1,1,"0af3cb8a-56df-43fd-9053-413569b63d0d","","","LAWRENCE LIVERMORE NATIONAL SECURITY, LLC",2
"146",20220189647,0,"G","G21","G21B","G21B1/19","inventional","2013-01-01","F",17433924,"2020-02-24","utility","","2022-06-16","A1",17,"Direct Nuclear Power Conversion","Articles of manufacture, machines, processes for using the articles and machines, processes for making the articles and machines, and products produced by the process of making, along with necessary intermediates, directed to direct nuclear power conversion.",FALSE,"","e7d6302f-16c7-11ed-9b5f-1234bde3cd05","West Chicago","IL","US",41.8847507,-88.2039607,"DuPage",17,43,1,"36f84a85-e949-4942-9470-5fad4370f3fa","","","Beam Alpha, Inc.",2
"147",20190122774,1,"G","G21","G21B","G21B3/00","additional","2013-01-01","L",16016318,"2018-06-22","utility","","2019-04-25","A1",16,"ENERGY GENERATION APPARATUS AND METHOD","A practical technique for inducing and controlling the fusion of nuclei within a solid lattice. A reactor includes a loading source to provide the light nuclei which are to be fused, a lattice which can absorb the light nuclei, a source of phonon energy, and a control mechanism to start and stop stimulation of phonon energy and/or the loading of reactants. The lattice transmits phonon energy sufficient to affect electron-nucleus collapse. By controlling the stimulation of phonon energy and controlling the loading of light nuclei into the lattice, energy released by the fusion reactions is allowed to dissipate before it builds to the point that it causes destruction of the reaction lattice.",FALSE,"ipa190425.xml","b21cc8f7-16c7-11ed-9b5f-1234bde3cd05","Berkeley","CA","US",37.8708393,-122.272863,"Alameda",6,1,1,"8944147d-5f91-4d2d-8376-dc411ca082ed","","","Brillouin Energy Corp.",2
"148",20130064340,1,"G","G21","G21B","G21B1/19","inventional","2013-01-01","L",13614831,"2012-09-13","utility","","2013-03-14","A1",13,"Method and System to Remove Debris from a Fusion Reactor Chamber","A method of removing a debris cloud from a fusion reactor includes injecting a fluid jet into the fusion reactor at a first velocity and thereafter, injecting a fusion target into the fusion reactor at a second velocity. The method also includes irradiating the fusion target with laser light and creating a fusion event. The method further includes forming a debris cloud in a vicinity of the fusion event and removing the debris cloud from the fusion reactor. The fluid jet applies a motive force to the debris cloud.",FALSE,"ipa130314.xml","2119e392-16c8-11ed-9b5f-1234bde3cd05","Livermore","CA","US",37.6820583,-121.7680531,"Alameda",6,1,1,"0af3cb8a-56df-43fd-9053-413569b63d0d","","","LAWRENCE LIVERMORE NATIONAL SECURITY, LLC",2
"149",20200028313,1,"G","G21","G21B","G21B1/23","inventional","2013-01-01","L",16514153,"2019-07-17","utility","","2020-01-23","A1",16,"Arrangement of Expanding Optical Flows for Efficient Laser Extraction","A set of optical elements for optical extraction composed of packed expanding optical cross sections to efficiently extract from a large gain region. The elements are rectangular shaped concave small expansion lenses matched to rectangular convex collimating lenses. Absorbing sheets divide an overall large volume up into smaller volumes to minimize losses due to amplified spontaneous emission. This arrangement has various applications, particularly in inertial confinement technology, where it may be used to extract energy from KrF laser media energized by electron beams. For certain applications, this regime of the gain medium may have zones at the absorbing sheets where this is no gain.",FALSE,"ipa200123.xml","cc7477c5-16c7-11ed-9b5f-1234bde3cd05","Colorado Springs","CO","US",38.8339578,-104.825348,"El Paso",8,41,1,"ad428b20-e4ae-4a65-afe9-449a13143a07","","","Innoven Energy LLC",2
"150",20070234808,0,"G","G21","G21B","G21B3/00","inventional","2013-01-01","F",11235879,"2005-09-26","utility","","2007-10-11","A1",11,"Method and apparatus for monitoring temperature differences within a cavitation chamber","A method and apparatus for monitoring a temperature difference between two regions within a cavitation system is provided. The system's cavitation chamber is partially or completely filled with cavitation fluid, the amount that the system is filled controlling whether a cavitation fluid free surface is formed within the cavitation chamber or a conduit coupled to the chamber. Regardless of whether the region of the system above the cavitation fluid free surface is within the chamber or within the conduit, a temperature difference is created between this region and the cavitation fluid within the cavitation chamber. The temperature difference between these two regions is monitored by monitoring the temperature of each region. The temperature difference can be created by either heating the region above the cavitation fluid free surface, cooling the cavitation fluid, or both.",FALSE,"ipa071011.xml","a3fdf49b-16c8-11ed-9b5f-1234bde3cd05","Grass Valley","CA","US",39.2190607,-121.06292,"Nevada",6,57,1,"940ec262-6b95-4f7a-ab52-2ebd363d9fed","","","Impulse Devices, Inc.",2
"151",20190122773,0,"G","G21","G21B","G21B3/00","inventional","2013-01-01","F",16048915,"2018-07-30","utility","","2019-04-25","A1",16,"CONTROL OF LOW ENERGY NUCLEAR REACTIONS HYDRIDES, AND AUTONOMOUSLY CONTROLLED HEAT MODULE","A treatment of a possibly powdered, sintered, or deposited lattice (e.g., nickel) for heat generating applications and a way to control low energy nuclear reactions (“LENR”) hosted in the lattice by controlling hydride formation. The method of control and treatment involves the use of the reaction lattice, enclosed by an inert cover gas such as argon that carries hydrogen as the reactive gas in a non-flammable mixture. Hydrogen ions in the lattice are transmuted to neutrons as discussed in U.S. Patent Application Publication No. 2007/0206715 (Godes_2007)). Hydrogen moving through the lattice interacts with the newly formed neutrons generating an exothermic reaction.",FALSE,"ipa190425.xml","b21cc8f7-16c7-11ed-9b5f-1234bde3cd05","Berkeley","CA","US",37.8708393,-122.272863,"Alameda",6,1,1,"8944147d-5f91-4d2d-8376-dc411ca082ed","","","Brillouin Energy Corp.",2
"154",20210350943,2,"G","G21","G21B","G21B1/23","inventional","2013-01-01","L",17192748,"2021-03-04","utility","","2021-11-11","A1",17,"Propellant Grading","A confinement chamber for Inertial Confinement Fusion (ICF) may include a closed hohlraum and ICF target wherein the ICF target may comprise a central spherical fuel region, inner shell, outer fuel region, outer shell, and propellant region. A multitude of cylindrical beam channels may penetrate the entire thickness of the hohlraum. At the end of each cylindrical beam channel, where they exit the hohlraum, is a hemispherical cavity. Centered in the curvature of each cavity, and coaxial with each beam channel is a gold foam radiator. By layering materials or grading the density of a material in the propellant region of the closed hohlraum ICF target, the pressure profile on the outer shell may be tailored.",FALSE,"","cc7477c5-16c7-11ed-9b5f-1234bde3cd05","Colorado Springs","CO","US",38.8339578,-104.825348,"El Paso",8,41,1,"ad428b20-e4ae-4a65-afe9-449a13143a07","","","Innoven Energy LLC",2
"156",20130089171,0,"G","G21","G21B","G21B1/057","inventional","2013-01-01","F",13700785,"2011-05-26","utility","","2013-04-11","A1",13,"Compact Fusion Reactor","A compact nuclear fusion reactor for use as a neutron source is described. The reactor comprises a toroidal plasma chamber (34) and a plasma confinement system (31) arranged to generate a magnetic field for confining a plasma in the plasma chamber (34). The plasma confinement system (31) is configured so that a major radius of the confined plasma is 0.75 m or less. The reactor is configure to operate with a plasma current of 2 MA or less. The magnetic field includes a toroidal component of 5 T or less. Despite these low values, the reactor can generate a neutron output of 1 MW or more.",FALSE,"ipa130411.xml","87d6f9e7-16c8-11ed-9b5f-1234bde3cd05","Woodstock","","GB",51.8474887,-1.3545343,"",NA,NA,1,"748c89bb-197d-4130-a86b-fab4f88e4bcd","","","TOKAMAK SOLUTIONS UK LIMITED",3
"157",20180261753,1,"G","G21","G21B","G21B1/057","inventional","2013-01-01","L",15757099,"2016-09-05","utility","","2018-09-13","A1",15,"HTS MAGNET SECTIONS","There is disclosed an assembly for carrying electrical current in a coil of a magnet. The assembly comprises a pre-formed housing of thermally and electrically conductive material (e.g. copper) which comprises a channel configured to retain HTS tape. A plurality of layers of HTS tape are fixed within the channel. The channel has at least one pre-formed curved section.",FALSE,"ipa180913.xml","87d6f9e7-16c8-11ed-9b5f-1234bde3cd05","Woodstock","","GB",51.8474887,-1.3545343,"",NA,NA,1,"f6ca43fd-e5d8-48da-91bd-f0915c0a8038","","","Tokamak Energy Ltd.",3
"158",20150255210,3,"G","G21","G21B","G21B1/23","inventional","2013-01-01","L",14718334,"2015-05-21","utility","","2015-09-10","A1",14,"Electron-Coupled Transformer","An Electron-coupled transformer for generating a high voltage output pulse as an amplified version of an input pulse comprises a cylindrical triode electron tube with a central anode along main axis and a grid and cathode radially spaced from the anode. The anode has a first end connected to ground and a second end insulated with respect to said ground. The cathode and the grid form a traveling wave electron gun that produces a wave of ground potential in the Transverse Electric Mode, which causes electrons stored in the cathode-grid gap to be extracted from said gap. The extracted electrons form a radially symmetric collapsing traveling wave that sweeps as a wave along the anode at the speed of light, causing a voltage output pulse on the second end of the anode whose magnitude is an amplified version of an input pulse applied to the cathode.",FALSE,"ipa150910.xml","08354425-16c8-11ed-9b5f-1234bde3cd05","Newtown","CT","US",41.4134764,-73.3086445,"Fairfield",9,1,1,"4ff8d96b-aaf1-44de-b537-f6150d48a916","","","ADVANCED FUSION SYSTEMS LLC",2
"160",20100206742,0,"G","G21","G21B","G21B3/00","inventional","2013-01-01","F",12704058,"2010-02-11","utility","","2010-08-19","A1",12,"ULTRASONIC TREATMENT CHAMBER FOR TREATING HYDROGEN ISOTOPES","A system is disclosed for treating hydrogen isotopes. Specifically, the system includes a treatment chamber that has an elongate housing through which liquid and gas isotopes flow longitudinally from an inlet port to an outlet port thereof. An elongate ultrasonic waveguide assembly extends within the housing and is operable at a predetermined ultrasonic frequency and a predetermined electrical potential to ultrasonically enhance the concentration of dissolved hydrogen gas isotopes within the housing or energize and electrolyze the liquid and gas isotopes within the housing. An elongate ultrasonic horn of the waveguide assembly is disposed at least in part intermediate the inlet and outlet ports, and has a plurality of discrete agitating members in contact with and extending transversely outward from the horn intermediate the inlet and outlet ports in longitudinally spaced relationship with each other.",FALSE,"ipa100819.xml","e9ec8d99-16c7-11ed-9b5f-1234bde3cd05","Neenah","WI","US",44.1858193,-88.462609,"Winnebago",55,139,1,"b02f6953-405f-4b26-b7cb-5802ef9201de","","","Kimberly-Clark Worldwide, Inc.",2
"161",20110293056,2,"G","G21","G21B","G21B1/19","additional","2013-01-01","L",13201428,"2010-02-12","utility","","2011-12-01","A1",13,"METHOD AND APPARATUS FOR THE GENERATION, HEATING AND/OR COMPRESSION OF PLASMOIDS AND/OR RECOVERY OF ENERGY THEREFROM","Method and apparatus for heating and/or compressing plasmas to thermonuclear temperatures and densities are provided. In one aspect, at least one of at least two plasmoids separated by a distance is accelerated towards the other. The plasmoids interact, for instance to form a resultant plasmoid, to convert a kinetic energy into a thermal energy. The resultant plasmoid is confined in a high energy density state using a magnetic field. One or more plasmoids may be compressed. Energy may be recovered, for example via a blanket and/or directly via one or more coils that create a magnetic field and/or circuits that control the coils.",FALSE,"ipa111201.xml","816d1200-16c8-11ed-9b5f-1234bde3cd05","Redmond","WA","US",47.6694141,-122.1238767,"King",53,33,1,"f7ad7c1d-d742-4b4c-b029-78fc01493681","","","MSNW LLC",2
"162",20220005613,5,"G","G21","G21B","G21B1/05","inventional","2013-01-01","L",17314341,"2021-05-07","utility","","2022-01-06","A1",17,"GUITAR TRAINING DEVICE","A removable device for positioning a user's forearm and hand in relation to a guitar is provided. The removable device comprises: (i) a first strap overlying a first portion of the guitar and having attached thereto a first pad and a second pad; (ii) a second strap overlying a second portion of the guitar and joined to the first strap via a first connector, wherein the first connector is coupled to the guitar at a first point; and (iii) an adjustment mechanism overlying a third portion of the guitar and joined to the first strap, the second strap, the first connector, and a second connector, wherein the second connector is coupled to the guitar at a second point.",FALSE,"","e1c05366-16c7-11ed-9b5f-1234bde3cd05","Chicago","IL","US",41.8755616,-87.6244212,"Cook",17,31,1,"c2b19715-462a-4232-914c-d49d1c4a889a","","","STRUM PERFECT LLC",2
"163",20180087165,5,"G","G21","G21B","G21B3/00","additional","2013-01-01","L",15438768,"2017-02-22","utility","","2018-03-29","A1",15,"MODULAR ELECTROLYSIS APPARATUS WITH COOLED HEADER, CO-DISPOSED HEAT EXCHANGER AND GAS MANIFOLDS THEREFOR","An improved, gaseous electrolysis apparatus can include a cooled header for electric connections or couplings, an exemplary co-disposed, coaxial heat exchanger around the reaction chamber to extract heat from the reaction chamber and exemplary rugged gas source and collection manifold(s) to support fixed and/or mobile applications in an embodiment. The system can include a heated anode and co-disposed cylindrical cathode within the reaction chamber and an improved electronic control circuit in an embodiment.",FALSE,"ipa180329.xml","fb52205e-16c7-11ed-9b5f-1234bde3cd05","Fairfax","VA","US",38.8462236,-77.3063733,"Fairfax (city)",51,600,1,"3dc7a06d-54bc-4c33-992e-70afc769a635","","","Marathon Systems, Inc.",2
"164",20110122984,1,"G","G21","G21B","G21B3/00","additional","2013-01-01","L",12911586,"2010-10-25","utility","","2011-05-26","A1",12,"ENERGY GENERATION APPARATUS AND METHOD","A practical technique for inducing and controlling the fusion of nuclei within a solid lattice. A reactor includes a loading source to provide the light nuclei which are to be fused, a lattice which can absorb the light nuclei, a source of phonon energy, and a control mechanism to start and stop stimulation of phonon energy and/or the loading of reactants. The lattice transmits phonon energy sufficient to affect electron-nucleus collapse. By controlling the stimulation of phonon energy and controlling the loading of light nuclei into the lattice, energy released by the fusion reactions is allowed to dissipate before it builds to the point that it causes destruction of the reaction lattice.",FALSE,"ipa110526.xml","b21cc8f7-16c7-11ed-9b5f-1234bde3cd05","Berkeley","CA","US",37.8708393,-122.272863,"Alameda",6,1,1,"8944147d-5f91-4d2d-8376-dc411ca082ed","","","Brillouin Energy Corp.",2
"167",20060018419,0,"G","G21","G21B","G21B3/00","inventional","2013-01-01","F",10961353,"2004-10-07","utility","","2006-01-26","A1",10,"Heat exchange system for a cavitation chamber","A method and apparatus for regulating the temperature of the cavitation medium for a cavitation chamber is provided. The cavitation medium is pumped through the cavitation chamber through a pair of chamber inlets and an external conduit connecting the two inlets. An external heat exchanger is used to regulate the cavitation medium temperature, the heat exchanger being either directly or indirectly coupled to the conduit. The cavitation medium can be circulated through the heat exchanger during chamber operation or, once the desired cavitation medium temperature is achieved, operation of the circulation system can be suspended. The heat exchanger can be used to lower the temperature of the cavitation medium to a temperature less than the ambient temperature; to withdraw excess heat from the cavitation medium; or to heat the cavitation medium to the desired operating temperature. The heat exchanger can utilize heated heat exchange fluid, cooled heat exchange fluid, thermoelectric coolers, heat sinks, refrigeration systems or heaters. The cavitation medium circulation system can be configured to include a filter and/or a degassing chamber.",FALSE,"ipa060126.xml","a3fdf49b-16c8-11ed-9b5f-1234bde3cd05","Grass Valley","CA","US",39.2190607,-121.06292,"Nevada",6,57,1,"940ec262-6b95-4f7a-ab52-2ebd363d9fed","","","Impulse Devices, Inc.",2
"168",20210090752,0,"G","G21","G21B","G21B3/002","inventional","2013-01-01","F",16579930,"2019-09-24","utility","","2021-03-25","A1",16,"Low Energy Nuclear Reactor","A low energy nuclear reactor (LENR) is provided for producing thermal energy. The LENR includes first and second vessels and an ignitor. The first vessel defined a first chamber containing LENR fuel. The second vessel disposed inside the first vessel defines a second chamber containing exothermic material. The ignitor initiates the exothermic material by sparking. The LENR fuel reacts to produce the thermal energy in response to initiation heat from the exothermic material.",FALSE,"ipa210325.xml","030c312b-16c8-11ed-9b5f-1234bde3cd05","Arlington","VA","US",38.8903961,-77.0841585,"Arlington",51,13,1,"e6ddc944-a574-44cc-b839-f1d0405fcd9e","","","United States of America as represented by the Secretary of the Air Force",6
"170",20140119488,1,"G","G21","G21B","G21B3/002","inventional","2013-01-01","L",14077942,"2013-11-12","utility","","2014-05-01","A1",14,"NUCLIDE TRANSMUTATION DEVICE AND NUCLIDE TRANSMUTATION METHOD","The present invention produces nuclide transmutation using a relatively small-scale device. The device 10 that produces nuclide transmutation comprises a structure body 11 that is substantially plate shaped and made of palladium (Pd) or palladium alloy, or another metal that absorbs hydrogen (for example, Ti) or an alloy thereof, and a material 14 that undergoes nuclide transmutation laminated on one surface 11A among the two surfaces of this structure body 11. The one surface 11 A side of the structure body 11, for example, is made a region in which the pressure of the deuterium is high due to pressure or electrolysis and the like, and the other surface 11B side, for example, is a region in which the pressure of the deuterium is low due to vacuum exhausting and the like, arid thereby, a flow of deuterium in the structure body 11 is produced, and nuclide transmutation is carried out by a reaction between the deuterium and the material 14 that undergoes nuclide transmutation.",FALSE,"ipa140501.xml","b492ce4e-16c7-11ed-9b5f-1234bde3cd05","Minato","","JP",35.6432274,139.7400553,"",NA,NA,1,"8c6f9cc8-db14-4f7d-97dd-beb805889fe0","","","MITSUBISHI HEAVY INDUSTRIES, LTD.",3
