"","pgpub_id","cpc_sequence","cpc_section","cpc_class","cpc_subclass","cpc_group","cpc_type","cpc_version_indicator","cpc_symbol_position","application_id","filing_date","patent_type","filing_type","published_date","wipo_kind","series_code","application_title","application_abstract","rule_47_flag","filename","location_id","disambig_city","disambig_state","disambig_country","latitude","longitude","county","state_fips","county_fips","assignee_sequence","assignee_id","disambig_assignee_individual_name_first","disambig_assignee_individual_name_last","disambig_assignee_organization","assignee_type"
"48",20140120456,6,"G","G21","G21B","G21B1/11","inventional","2013-01-01","L",14147743,"2014-01-06","utility","","2014-05-01","A1",14,"PERMEATION BARRIER LAYER","A sealable volume has a wall forming at least a portion of a boundary limiting the volume. The wall includes a hydrogen permeation barrier including a layer system (LS) having at least one layer. The layer system includes at least one hydrogen barrier layer (HPBL) of an at least ternary oxide. Preferably, the oxide is substantially composed of Al, Cr and O and the hydrogen barrier layer (HPBL) is deposited using physical vapor deposition, in particular cathodic arc evaporation. Preferably, the layer system includes at least one of: an adhesion layer (AdhL), a hydrogen storage layer (HStL), a protective layer (ProtL), in particular a thermal barrier layer (ThBL), a diffusion barrier layer (DBL), an oxidation barrier layer (OxBL), a chemical barrier layer (ChBL), a wear resistance layer (WRL). Excellent hydrogen permeation barrier properties can be achieved, and the layer system can be tailored as required by an envisaged application.",FALSE,"ipa140501.xml","2d50556d-16c8-11ed-9b5f-1234bde3cd05","Wetzikon","","CH",47.3226925,8.7980939,"",NA,NA,1,"dfceb878-95ea-44da-9bea-8cfc775e7814","","","OERLIKON TRADING AG, TRUEBBACH",3
"49",20110286570,0,"G","G21","G21B","G21B1/01","inventional","2013-01-01","F",12681343,"2008-09-30","utility","","2011-11-24","A1",12,"SOLID HOLLOW CORE FUEL FOR FUSION-FISSION ENGINE","A fuel pebble for use in a fusion-fission engine includes a buffer material and a fertile or fissile fuel shell surrounding the buffer material. The fuel pebble also includes a containment shell surrounding the fertile or fissile fuel shell. The containment shell includes silicon carbide. The fuel pebble further includes a composite material layer surrounding the containment shell and a cladding layer surrounding the composite material layer.",FALSE,"ipa111124.xml","2119e392-16c8-11ed-9b5f-1234bde3cd05","Livermore","CA","US",37.6820583,-121.7680531,"Alameda",6,1,1,"0af3cb8a-56df-43fd-9053-413569b63d0d","","","LAWRENCE LIVERMORE NATIONAL SECURITY, LLC",2
"50",20200402677,0,"G","G21","G21B","G21B1/052","inventional","2013-01-01","F",17011400,"2020-09-03","utility","","2020-12-24","A1",17,"SYSTEM AND METHOD FOR SMALL, CLEAN, STEADY-STATE FUSION REACTORS","According to some embodiments, a system for widening and densifying a scrape-off layer (SOL) in a field reversed configuration (FRC) fusion reactor is disclosed. The system includes a gas box at one end of the reactor including a gas inlet system and walls of suitable heat bearing materials. The system further includes an exit orifice adjoining the gas box, wherein the exit orifice has a controllable radius and length to allow plasma to flow out from the gas box to populate the SOL with the plasma. The system may also include fusion products, which decrease in speed in the plasma in the SOL, allowing energy to be extracted and converted into thrust or electrical power and further allowing ash to be extracted to reduce neutron emissions and maintain high, steady-state fusion power.",FALSE,"ipa201224.xml","08356fad-16c8-11ed-9b5f-1234bde3cd05","Princeton","NJ","US",40.3492744,-74.6592958,"Mercer",34,21,1,"43de0fb5-fd36-411d-b6d3-ca4cf1668cc7","","","THE TRUSTEES OF PRINCETON UNIVERSITY",2
"51",20200027570,0,"G","G21","G21B","G21B1/00","inventional","2013-01-01","F",16250236,"2019-01-17","utility","","2020-01-23","A1",16,"IN SPACE STARTUP METHOD FOR NUCLEAR FUSION ROCKET ENGINES","The invention is for a startup system for nuclear fusion engines in space. The combustion of hydrogen and oxygen produces heat that is used by a heat engine to produce electricity. This can be supplemented by electricity from other operating engines. The exhaust from the combustion is condensed and electrolyzed to produce hydrogen and oxygen once the engine is in operation. This provides a constant source of energy for future startups. The engine is started up at partial power in electricity generation mode and this power replaces the power from the combustion as it grows. The combustor uses the same heat engine as the nuclear engine uses for power generation.",FALSE,"ipa200123.xml","08356fad-16c8-11ed-9b5f-1234bde3cd05","Princeton","NJ","US",40.3492744,-74.6592958,"Mercer",34,21,2,"43de0fb5-fd36-411d-b6d3-ca4cf1668cc7","","","THE TRUSTEES OF PRINCETON UNIVERSITY",2
"53",20110033018,1,"G","G21","G21B","G21B1/13","inventional","2013-01-01","L",12538725,"2009-08-10","utility","","2011-02-10","A1",12,"METHOD FOR BONDING CERAMIC MATERIALS","Systems and methods for bonding ceramic materials are disclosed herein. In various embodiments, a process is provided comprising the steps of disposing a bonding material at least partially adjacent to a surface of a first silicon carbide component and at least partially adjacent to a surface of a second silicon carbide component, and bonding said first silicon carbide component to said second silicon carbide component by heating, wherein said bonding material comprises vanadium or titanium.",FALSE,"ipa110210.xml","c6c67c19-16c7-11ed-9b5f-1234bde3cd05","Provo","UT","US",40.2337289,-111.6587085,"Utah",49,49,1,"916c76fa-b562-4940-a7a3-275ea0066d4d","","","Caldera Engineering, LC",2
"54",20110228890,0,"G","G21","G21B","G21B3/00","inventional","2013-01-01","F",12263901,"2008-11-03","utility","","2011-09-22","A1",12,"SYSTEM AND METHOD FOR CREATING LIQUID DROPLET IMPACT FORCED COLLAPSE OF LASER NANOPARTICLE NUCLEATED CAVITIES","A device, method and system for causing a controlled collapse of cavities formed within liquid droplets wherein a pressurized jet comprising a liquid and nanoparticle material produces droplets from the breakup of the jet stream. The liquid droplets may be irradiated with energy to produce and expand cavities formed within the droplets by irradiation of the nanoparticles contained within the droplets or alternatively, a volatile fluid with or without a metal nanoparticle may form the cavity. The droplets are collided with a target to collapse the cavities within the droplets. The irradiating (if provided) and colliding are timed to enhance implosion energy resulting from the cavities' collapse. The implosion energy and the fuel in the cavity may be used to activate and sustain a fusion reaction or from any other purposes.",FALSE,"ipa110922.xml","3b26f9ae-16c8-11ed-9b5f-1234bde3cd05","Lebanon","NH","US",43.643032,-72.251587,"Grafton",33,9,1,"2c394901-7977-4165-8c86-48fbfc2cff8e","","","Energy Innovations, LLC",2
"55",20200403555,0,"G","G21","G21B","G21B1/00","inventional","2013-01-01","F",16071101,"2017-01-18","utility","","2020-12-24","A1",16,"THERMOPHOTOVOLTAIC ELECTRICAL POWER GENERATOR","A molten metal fuel to plasma to electricity power source that provides at least one of electrical and thermal power comprising (i) at least one reaction cell for the catalysis of atomic hydrogen to form hydrinos, (ii) a chemical fuel mixture comprising at least two components chosen from: a source of H2O catalyst or H2O catalyst; a source of atomic hydrogen or atomic hydrogen; reactants to form the source of H2O catalyst or H2O catalyst and a source of atomic hydrogen or atomic hydrogen; and a molten metal to cause the fuel to be highly conductive, (iii) a fuel injection system comprising an electromagnetic pump, (iv) at least one set of electrodes that confine the fuel and an electrical power source that provides repetitive short bursts of low-voltage, high-current electrical energy to initiate rapid kinetics of the hydrino reaction and an energy gain due to forming hydrinos to form a brilliant-light emitting plasma, (v) a product recovery system such as at least one of an electrode electromagnetic pump recovery system and a gravity recovery system, (vi) a source of H2O vapor supplied to the plasma and (vii) a power converter capable of converting the high-power light output of the cell into electricity such as a concentrated solar power thermophotovoltaic device and a visible and infrared transparent window or a plurality of ultraviolet (UV) photovoltaic cells or a plurality of photoelectric cells, and a UV window.",FALSE,"ipa201224.xml","09505cb9-16c8-11ed-9b5f-1234bde3cd05","Cranbury","NJ","US",40.3162195,-74.5137645,"Middlesex",34,23,1,"a5bf7330-092b-4a9c-b862-60ec603d9ba5","","","BRILLIANT LIGHT POWER, INC.",2
"56",20140332087,3,"G","G21","G21B","G21B3/002","inventional","2013-01-01","L",14189751,"2014-02-25","utility","","2014-11-13","A1",14,"Control of Low Energy Nuclear Reaction Hydrides, and Autonomously Controlled Heat","A treatment of a possibly powdered, sintered, or deposited lattice (e.g., nickel) for heat generating applications and a way to control low energy nuclear reactions (“LENR”) hosted in the lattice by controlling hydride formation. The method of control and treatment involves the use of the reaction lattice, enclosed by an inert cover gas such as argon that carries hydrogen as the reactive gas in a non-flammable mixture. Hydrogen ions in the lattice are transmuted to neutrons as discussed in U.S. Patent Application Publication No. 2007/0206715 (Godes_2007)). Hydrogen moving through the lattice interacts with the newly formed neutrons generating an exothermic reaction.",FALSE,"ipa141113.xml","b21cc8f7-16c7-11ed-9b5f-1234bde3cd05","Berkeley","CA","US",37.8708393,-122.272863,"Alameda",6,1,1,"8944147d-5f91-4d2d-8376-dc411ca082ed","","","Brillouin Energy Corp.",2
"57",20070253285,0,"G","G21","G21B","G21B3/00","inventional","2013-01-01","F",11226641,"2005-09-14","utility","","2007-11-01","A1",11,"Method and apparatus for controlling and monitoring temperature differences within a cavitation chamber","A method and apparatus for forming a temperature difference between two regions within a cavitation chamber is provided. The cavitation chamber is partially filled with cavitation fluid, thereby forming a cavitation fluid free surface which divides the chamber into a first region located above the cavitation fluid free surface and a second region located below the cavitation fluid free surface. The region above the cavitation fluid free surface is heated in order to form the desired temperature difference, heat being provided by a resistive heater or other means. In addition to heating the region above the cavitation fluid free surface, the region below the cavitation fluid free surface can be cooled, for example utilizing a refrigerated container, refrigeration coils, a thermoelectric cooler, or other means. A temperature monitor can be thermally coupled to the first region, the second region, or both.",FALSE,"ipa071101.xml","a3fdf49b-16c8-11ed-9b5f-1234bde3cd05","Grass Valley","CA","US",39.2190607,-121.06292,"Nevada",6,57,1,"940ec262-6b95-4f7a-ab52-2ebd363d9fed","","","Impulse Devices, Inc.",2
"58",20210272706,4,"G","G21","G21B","G21B3/008","inventional","2013-01-01","L",15733950,"2019-06-03","utility","","2021-09-02","A1",15,"System and method for phonon-mediated excitation and de-excitation of nuclear states","The present invention relates to a system for a system for generating energetic particles including a device for generating an ion beam comprising a first group of atomic nuclei, and a condensed matter medium comprising a second group of atomic nuclei. The ion beam is configured to interact with the condensed matter medium so that some atomic nuclei of the first group of atomic nuclei are implanted into the condensed matter medium and undergo a first nuclear reaction thereby releasing a first energy. The ion beam is further configured to generate high-frequency phonons in the condensed matter medium. The high-frequency phonons are configured to interact with the second group of atomic nuclei and affect nuclear states of the second group of atomic nuclei by transferring the first energy of the first group of atomic nuclei to the second group of atomic nuclei and causing the second group of atomic nuclei to undergo a second nuclear reaction and emit energetic particles.",FALSE,"","21057cd0-16c8-11ed-9b5f-1234bde3cd05","Cambridge","","GB",52.2055314,0.1186637,"",NA,NA,1,"141701b1-2e8c-4148-b37b-8a08d26b0df1","","","CAMBRIDGE PHONON SYSTEMS, INC",2
"60",20200263981,0,"G","G21","G21B","G21B1/19","inventional","2013-01-01","F",16796084,"2020-02-20","utility","","2020-08-20","A1",16,"Effect of Fuel Doping in ICF Targets","In Inertial Confinement Fusion (ICF) targets that ignite a fuel section having a low areal density at ignition, the fuel section tends to have a very non-uniform temperature profile. As the areal density decreases, the temperature profile becomes less uniform. This leads to non-equilibrium ignition and a non-uniform density profile. However, there is an optimal material and content for the fuel region for any given target design. One can smooth both the temperature and density profiles in the fuel of non-equilibrium ignition targets while still allowing runaway burn but preventing margin parameters such as fall-line from being affected greatly.",FALSE,"ipa200820.xml","cc7477c5-16c7-11ed-9b5f-1234bde3cd05","Colorado Springs","CO","US",38.8339578,-104.825348,"El Paso",8,41,1,"ad428b20-e4ae-4a65-afe9-449a13143a07","","","Innoven Energy LLC",2
"61",20110132973,9,"G","G21","G21B","G21B1/13","inventional","2013-01-01","L",12962971,"2010-12-08","utility","","2011-06-09","A1",12,"METHOD OF MANUFACTURING HIGH-HEAT-LOAD EQUIPMENT BY METALLURGICALLY JOINING CARBON MATERIAL WITH COPPER-ALLOY MATERIAL","A method of manufacturing high-heat-load equipment including a carbon material and a copper alloy material which are joined with each other includes; forming a titanium thin layer on a surface of the carbon material; positioning the carbon material so that the titanium thin layer is opposed to the copper alloy material while an interlayer is interposed between the carbon material and the copper alloy material; inserting a brazing material sheet into a space between the carbon material and the interlayer, as well as into a space between the interlayer and the copper alloy material, so as to prepare an assembly of the materials; and subjecting the assembly to a vacuum brazing process and further to an aging process.",FALSE,"ipa110609.xml","9df03fac-16c8-11ed-9b5f-1234bde3cd05","Kobe","","JP",34.6932379,135.1943764,"",NA,NA,1,"255f3b0c-138c-4742-ac27-f3dcfd865d3b","","","KAWASAKI JUKOGYO KABUSHIKI KAISHA",3
"62",20200051701,1,"G","G21","G21B","G21B1/19","inventional","2013-01-01","L",16600244,"2019-10-11","utility","","2020-02-13","A1",16,"METHODS AND APPARATUS FOR FACILITATING LOCALIZED NUCLEAR FUSION REACTIONS ENHANCED BY ELECTRON SCREENING","Methods and apparatuses for facilitating localized nuclear fusion reactions in a globally cold deeply screened fuel source are disclosed, where the volume of cold fuel is much larger than that of hot fuel participating in fission reactions, maintaining structural integrity. Such a deeply screened environment may facilitate the combination of shell and conduction electrons and plasma channels created from external x-ray and/or gamma irradiation. Deeply screened fuel nuclei can tunnel at lower energies, and can much more effectively scatter at high angles, leading to increased tunneling probabilities. Local “hot” fusion conditions may be created by providing neutral hot particles (e.g., hot neutrons) that are substantially more effective at high angle scattering off charged fuel nuclei and can deliver around a half of their kinetic energy in one collision to result in a hot fuel nucleus. Such methods and apparatuses may have various applications, such as heat or medical isotope production.",FALSE,"ipa200213.xml","83dc20fd-16c8-11ed-9b5f-1234bde3cd05","Avon Lake","OH","US",41.510033,-82.0185895,"Lorain",39,93,1,"1f59ad34-2b5a-46a2-88a8-f368ff5c6b45","","","PineSci Consulting",2
"63",20180366233,1,"G","G21","G21B","G21B1/05","inventional","2013-01-01","L",16008138,"2018-06-14","utility","","2018-12-20","A1",16,"MAGNETIC MIRROR DEVICE AND NEUTRAL BEAM INJECTION METHOD","A magnetic mirror device and neutral beam injection method is provided. The neutral beam is obliquely injected at a higher magnetic field position rather than at the midplane of magnetic mirror device. This method is beneficial for confining a higher density of fast ions at the turning point zone with a higher magnetic field, as well as obtaining a higher mirror ratio by reducing magnetic field intensity at middle plane rather than increasing the maximum magnetic field intensity of the magnetic mirror device. It increases a fusion power density of the fast ions reaction and reduces the end loss power plasma, consequently, higher fusion energy gain can be achieved.",FALSE,"ipa181220.xml","4a22c522-16c8-11ed-9b5f-1234bde3cd05","Hefei","","CN",31.8228094,117.2218033,"",NA,NA,1,"78d0c5e0-f268-4e45-bf2a-72941eb6bacc","","","HEFEI INSTITUTES OF PHYSICAL SCIENCE, CAS",3
"64",20040040737,1,"G","G21","G21B","G21B1/21","inventional","2013-01-01","L",10629837,"2003-07-30","new","publication-filing-type","2004-03-04","A1",10,"Superconducting coil system","A superconducting coil system comprising a superconducting coil and a normal conducting coil, the normal conducting coil having a current time constant (L 2 /R 2 ) which is larger than L 1 /R 1 , or the time constant at which the current through the superconducting coil decays rapidly after the conductors in the superconducting coil made a transition to the normal conducting state, in which L 1 and L 2 represent the self-inductances of the superconducting coil and the normal conducting coil, respectively, R 1 represents the resistance for causing rapid decay of the current flow through the superconducting coil, and R 2 represents the resistance of the normal conducting coil.",FALSE,"pa040304.xml","210d28b2-16c8-11ed-9b5f-1234bde3cd05","Kashiwa","","JP",35.8676218,139.9756876,"",NA,NA,1,"c260b1de-db43-4e90-9a3b-33f1855f4c39","","","Japan Atomic Energy Research Institute",3
"65",20130178686,4,"G","G21","G21B","G21B1/115","inventional","2013-01-01","L",13710985,"2012-12-11","utility","","2013-07-11","A1",13,"METHOD AND DEVICE FOR LIMITING THE DEGASSING OF TRITIATED WASTE ISSUED FROM THE NUCLEAR INDUSTRY","A method and device for limiting the degassing of tritiated waste issued from the nuclear industry are provided. The method reduces an amount of generated tritiated hydrogen (T2 or HT) and/or tritiated water (HTO or T2O) including at least one piece of tritiated waste from the nuclear industry. The method includes placing the package in contact with a mixture including manganese dioxide (MnO2) combined with a component that includes silver; and placing the package in contact with a molecular sieve.",FALSE,"ipa130711.xml","173808ad-16c8-11ed-9b5f-1234bde3cd05","Paris","","FR",48.8534951,2.3483915,"",NA,NA,1,"c8f1720f-8d69-41e9-9a75-1a96099be59f","","","COMMISSARIAT A L'ENERGIE ATOMIQUE ET AUX ENERGIES ALTERNATIVES",7
"66",20200243206,4,"G","G21","G21B","G21B3/006","inventional","2013-01-01","L",16775229,"2020-01-28","utility","","2020-07-30","A1",16,"Nuclides Bombardment Method and System for Neutron Generation","A method for nuclide bombardment for neutron generation includes providing a nuclide bombardment target. The target has a metallic single-crystalline layer including a metallic element, the single-crystalline layer including lattice channels disposed of therein, and isotopes of a first element, configured as interstitial elements in the lattice channels in the single-crystalline layer. The method also includes positioning the metallic single-crystalline layer with respect to a bombardment apparatus, such that the bombardment apparatus is configured for injecting particles into the metallic single-crystalline layer substantially along the lattice channels of the single crystalline lattice. The method further includes injecting isotopes of a second element into the metallic single-crystalline layer substantially along the direction of the lattice channels, thereby increasing neutron generation.",FALSE,"ipa200730.xml","c7b15c3f-16c7-11ed-9b5f-1234bde3cd05","Milpitas","CA","US",37.4282771,-121.9069256,"Santa Clara",6,85,1,"2c507ccb-8bc7-4216-bcdd-15a9099919c3","Tzu-Yin","Chiu","",4
"70",20150380113,1,"G","G21","G21B","G21B1/13","inventional","2013-01-01","L",14318246,"2014-06-27","utility","","2015-12-31","A1",14,"METHODS, DEVICES AND SYSTEMS FOR FUSION REACTIONS","Methods, apparatuses, devices, and systems for creating, controlling, conducting, and optimizing fusion activities of nuclei. The controlled fusion activities cover a spectrum of reactions from aneutronic, fusion reactions that produce essentially no neutrons, to neutronic, fusion reactions that produce substantial numbers of neutrons.",FALSE,"ipa151231.xml","c57918a0-16c7-11ed-9b5f-1234bde3cd05","San Fernando","CA","US",34.28497,-118.437652,"Los Angeles",6,37,1,"fda7d585-c8d9-4dbd-9d22-879cd7cab905","","","Nonlinear Ion Dynamics, LLC",2
"71",20190004435,5,"G","G21","G21B","G21B3/006","inventional","2013-01-01","L",16064332,"2016-12-14","utility","","2019-01-03","A1",16,"METHOD AND APPARATUS FOR DIRECT WRITE MASKLESS LITHOGRAPHY","A patterning apparatus, including: a substrate holder constructed to support a substrate; a particle generator configured to generate particles in the patterning apparatus, the particle generator configured to deposit the particles onto the substrate to form a layer of particles on the substrate; and a pattern generator in the patterning apparatus, the pattern generator configured to applying a pattern in the patterning apparatus to the deposited layer of particles.",FALSE,"ipa190103.xml","60d41b65-16c8-11ed-9b5f-1234bde3cd05","Veldhoven","","NL",51.4190691,5.4045572,"",NA,NA,1,"34cefd54-fb9b-4f92-b757-0d2d9be68906","","","ASML Netherlands B.V.",3
"72",20130114774,2,"G","G21","G21B","G21B3/006","additional","2013-01-01","L",13696690,"2011-05-09","utility","","2013-05-09","A1",13,"LOCALISED ENERGY CONCENTRATION","A method of producing a localised concentration of energy comprises creating at least one shockwave (10) propagating through a non-gaseous medium (8) so as to be incident upon a pocket of gas (2) within the medium (8). The pocket of gas (2) is attached to a surface (6) comprising a depression (4) shaped so as partially to receive the gas pocket (2). An apparatus for producing a localised concentration of energy comprises a non-gaseous medium (8) having therein a pocket of gas (2). The pocket of gas (2) is attached to a surface (6) comprising a depression (4) shaped so as partially to receive the gas pocket (2). The apparatus further comprises means for creating at least one shockwave (10) propagating through the medium (8) so as to be incident upon the pocket of gas (2).",FALSE,"ipa130509.xml","01d0b911-16c8-11ed-9b5f-1234bde3cd05","Felton","","GB",39.8541597,-76.5649707,"",NA,NA,1,"e30b0f3b-f654-443d-8881-24f4b0b86d11","","","Isis Innovation Limited",3
"73",20160113158,1,"G","G21","G21B","G21B1/23","inventional","2013-01-01","L",14882768,"2015-10-14","utility","","2016-04-21","A1",14,"SYSTEM FOR ATTENUATING THE ELECTROMAGNETIC PULSE GENERATED IN A HIGH POWER LASER SETUP","A device attenuates an electromagnetic pulse generated in an installation in which a high-power laser beam is sent to a target mounted on a target support. The device includes an electrically conductive plate, electrically connected to an electric earth of the installation and to which the target support is fixed, a plate of material which absorbs electromagnetic waves fixed to one face of the electrically conductive plate located on the target support side and a device for passing a discharge current, which is the result of an interaction of the laser beam with the target, between the target and the electrically conductive plate, where the device for passing the discharge current is equipped with a device for attenuating the current.",FALSE,"ipa160421.xml","173808ad-16c8-11ed-9b5f-1234bde3cd05","Paris","","FR",48.8534951,2.3483915,"",NA,NA,1,"c8f1720f-8d69-41e9-9a75-1a96099be59f","","","COMMISSARIAT A L'ENERGIE ATOMIQUE ET AUX ENERGIES ALTERNATIVES",7
"74",20150187444,1,"G","G21","G21B","G21B3/00","additional","2013-01-01","L",14275653,"2014-05-12","utility","","2015-07-02","A1",14,"Energy Generation Apparatus and Method","A practical technique for inducing and controlling the fusion of nuclei within a solid lattice. A reactor includes a loading source to provide the light nuclei which are to be fused, a lattice which can absorb the light nuclei, a source of phonon energy, and a control mechanism to start and stop stimulation of phonon energy and/or the loading of reactants. The lattice transmits phonon energy sufficient to affect electron-nucleus collapse. By controlling the stimulation of phonon energy and controlling the loading of light nuclei into the lattice, energy released by the fusion reactions is allowed to dissipate before it builds to the point that it causes destruction of the reaction lattice.",FALSE,"ipa150702.xml","b21cc8f7-16c7-11ed-9b5f-1234bde3cd05","Berkeley","CA","US",37.8708393,-122.272863,"Alameda",6,1,1,"8944147d-5f91-4d2d-8376-dc411ca082ed","","","Brillouin Energy Corp.",2
